{
  "type": "create:crushing",
  "ingredients": [
    {
      "item": "thermal:lead_ore"
    }
  ],
  "results": [
    {
      "item": "create:crushed_lead_ore",
      "count": 2
    },
    {
      "item": "create:crushed_silver_ore",
      "chance": 0.1
    },
    {
      "item": "create:experience_nugget",
      "chance": 0.75
    },
    {
      "item": "minecraft:gravel",
      "chance": 0.2
    }
  ],
  "processingTime": 400
}