{
  "type": "create:crushing",
  "ingredients": [
    {
      "item": "thermal:tin_ore"
    }
  ],
  "results": [
    {
      "item": "create:crushed_tin_ore",
      "count": 2
    },
    {
      "item": "mw_core:crushed_apatite_ore",
      "chance": 0.5
    },
    {
      "item": "create:experience_nugget",
      "chance": 0.75
    },
    {
      "item": "minecraft:gravel",
      "chance": 0.2
    }
  ],
  "processingTime": 400
}