{
  "type": "create:crushing",
  "ingredients": [
    {
      "tag": "forge:ores/cobalt"
    }
  ],
  "results": [
    {
      "item": "mw_core:crushed_cobalt_ore",
      "count": 2
    },
    {
      "item": "create:crushed_iron_ore",
      "chance": 0.1
    },
    {
      "item": "create:cinder_flour",
      "chance": 0.12
    },
    {
      "item": "create:experience_nugget",
      "chance": 0.75
    }
  ],
  "processingTime": 400
}