{
  "type": "create:crushing",
  "ingredients": [
    {
      "item": "minecraft:deepslate_diamond_ore"
    }
  ],
  "results": [
    {
      "item": "mw_core:crushed_diamond_ore",
      "count": 2
    },
    {
      "item": "mw_core:crushed_diamond_ore",
      "chance": 0.5
    },
    {
      "item": "create:experience_nugget",
      "chance": 0.75
    },
    {
      "item": "minecraft:cobbled_deepslate",
      "chance": 0.2
    }
  ],
  "processingTime": 350
}