{
  "type": "create:crushing",
  "ingredients": [
    {
      "item": "minecraft:nether_quartz_ore"
    }
  ],
  "results": [
    {
      "item": "mw_core:crushed_nether_quartz_ore",
      "count": 2
    },
    {
      "item": "mw_core:crushed_nether_quartz_ore",
      "chance": 0.5
    },
    {
      "item": "mw_core:crushed_sulfur_ore",
      "chance": 0.25
    },
    {
      "item": "create:experience_nugget",
      "chance": 0.75
    },
    {
      "item": "minecraft:netherrack",
      "chance": 0.2
    }
  ],
  "processingTime": 350
}