{
  "type": "create:crushing",
  "ingredients": [
    {
      "item": "create:deepslate_zinc_ore"
    }
  ],
  "results": [
    {
      "item": "create:crushed_zinc_ore",
      "count": 2
    },
    {
      "item": "create:crushed_tin_ore",
      "chance": 0.1
    },
    {
      "item": "create:experience_nugget",
      "chance": 0.75
    },
    {
      "item": "minecraft:cobbled_deepslate",
      "chance": 0.2
    }
  ],
  "processingTime": 400
}